{
  "eventId": "{{eventId}}",
  "eventType": "MediaAssetStateChanged",
  "schemaVersion": 1,
  "aggregateId": "{{assetId}}",
  "aggregateVersion": 1,
  "occurredAt": "{{occurredAt}}",
  "correlationId": "{{correlationId}}",
  "payload": {
    "contentId": "{{contentId}}",
    "bindingId": "{{bindingId}}",
    "assetId": "{{assetId}}",
    "assetVersion": 1,
    "state": "PROCESSING"
  }
}
